{
  "schema_version": "enlightenment-ai-judgement-v1",
  "stock": {
    "code": "6282",
    "name": "康舒",
    "symbol": "6282.TW"
  },
  "as_of": "2025-06-23",
  "selection_context": {
    "first_selected_on": null,
    "active_sources": [],
    "is_active_watchlist_member": false
  },
  "data_quality": {
    "first_bar_date": "2022-06-01",
    "last_bar_date": "2025-06-23",
    "valid_bars": 750,
    "pre_roll_bars": 200,
    "corporate_action_adjusted": true,
    "cash_ledger_includes_distributions": true,
    "sufficiency": "PREFERRED",
    "notes": [
      "本檔僅示範結構化輸出；不是實際交易建議。",
      "AI 不得知道 2025-06-23 之後行情。"
    ]
  },
  "anchors": [
    {
      "id": "A-L-20250411",
      "role": "PRIMARY",
      "scale": "LARGE",
      "direction": "UP",
      "start_date": "2025-04-11",
      "end_date": "2025-05-21",
      "start_price": 21.3618,
      "end_price": 27.7413,
      "status": "CORRECTING",
      "quality": "ACCEPTABLE",
      "destructive_evidence": [
        "空頭末端後形成連續向上推進",
        "MACD 21/55/55 隨後由負轉正"
      ],
      "invalidation_description": "跌破 2025-04-11 起漲結構並無法快速收復"
    },
    {
      "id": "A-S-CORRECTION-20250623",
      "role": "ALTERNATIVE",
      "scale": "SMALL",
      "direction": "DOWN",
      "start_date": "2025-05-21",
      "end_date": null,
      "start_price": 27.7413,
      "end_price": null,
      "status": "FORMING",
      "quality": "UNRESOLVED",
      "destructive_evidence": [],
      "invalidation_description": "後續小級向上反向定錨並突破修正段道氏防線"
    }
  ],
  "structure": {
    "primary_scenario": "MACRO_COPY_RESONANCE",
    "alternative_scenarios": [
      "FRESH_Q1_EXPANSION",
      "UNRESOLVED"
    ],
    "confidence": "MEDIUM",
    "large_scale": {
      "direction": "UP",
      "quadrant": "UNRESOLVED",
      "dow_state": "TRANSITION",
      "dow_defense_price": 21.3618,
      "dow_defense_source_date": "2025-04-11",
      "explanation": "向上新生定錨仍在修正，大級多頭尚未完成複製確認。"
    },
    "small_scale": {
      "direction": "DOWN",
      "quadrant": "UNRESOLVED",
      "dow_state": "BEAR",
      "dow_defense_price": null,
      "dow_defense_source_date": null,
      "explanation": "當日仍只能確認修正進行，不能事後認定修正已結束。"
    },
    "scale_relationship": "MIXED",
    "taiji": {
      "phase": "CORRECTION",
      "generation": "ANCHOR_LEG_1",
      "parent_anchor_id": "A-L-20250411",
      "replication_quality": "NOT_APPLICABLE",
      "explanation": "第一段向上定錨完成後正在修正，下一個多頭複製尚未被市場確認。"
    },
    "left_right_phase": "DIRECT_TO_RIGHT",
    "stage_location": "EARLY",
    "rationale": "康舒已從原空頭背景形成新生向上定錨，但截至本日仍在修正；應先規劃小級轉強事件，不能把事後低點直接當成進場訊號。"
  },
  "evidence": [
    {
      "date": "2025-04-11",
      "kind": "PRICE_STRUCTURE",
      "description": "新生向上定錨候選的起點",
      "values": {"adjusted_low": 21.3618}
    },
    {
      "date": "2025-05-16",
      "kind": "MACD_21_55_55",
      "description": "還原收盤口徑下 MACD 柱狀體由負轉正",
      "values": {"cross": "POSITIVE"}
    },
    {
      "date": "2025-05-21",
      "kind": "PRICE_STRUCTURE",
      "description": "第一段向上推進高點，之後進入修正",
      "values": {"adjusted_high": 27.7413}
    },
    {
      "date": "2025-06-23",
      "kind": "PRICE_STRUCTURE",
      "description": "修正仍在進行；最低點身分尚不能由未來資料確認",
      "values": {"adjusted_low": 23.6816}
    }
  ],
  "disqualifiers": [
    {
      "code": "SCALE_CONFLICT",
      "severity": "WARNING",
      "description": "大級向上定錨與當下小級修正尚未形成策略共振。"
    }
  ],
  "decision": {
    "status": "STRUCTURE_MAPPED",
    "status_label_zh": "結構已辨識",
    "intent": "NONE",
    "trigger_state": "WAITING",
    "trigger_description": "等待小級向上反向定錨、突破修正段道氏防線，或拉回守住後重新轉強。",
    "invalidation": {
      "description": "跌破大級新生定錨起點並無法快速收復",
      "price": 21.3618,
      "source_date": "2025-04-11",
      "scale": "LARGE"
    },
    "execution_rule": "NONE",
    "entry_role": "NONE",
    "planned_nominal_twd": 0,
    "same_day_evidence_deduplicated": true,
    "campaign_id": "6282-UP-20250411",
    "trade_episode_id": null,
    "attempt_number": 0,
    "reentry_eligible": false,
    "reentry_reason": "尚未發生第一筆實際交易，不適用再進場。",
    "reason": "截至當日只有定錨後修正的結構，尚未出現可因果確認的小級轉強，因此不進場。"
  },
  "causal_attestation": {
    "latest_visible_bar": "2025-06-23",
    "used_future_data": false,
    "outcome_visible_to_ai": false
  }
}
